,sentence,intents,clean_sentence
6822,show me upcoming events in chicago,recommendation_events,show upcoming events chicago
6823,what exhibits or shows are scheduled at the metropolitan theater,recommendation_events,exhibits shows scheduled metropolitan theater
6824,recommend a blue grass band event within twenty miles of manchester ma this week,recommendation_events,recommend blue grass band event within twenty miles manchester week
6825,badminton,recommendation_events,badminton
6826,what kind of musical events are happening around here this week,recommendation_events,kind musical events happening around week
6827,events upcoming,recommendation_events,events upcoming
6828,hockey,recommendation_events,hockey
6829,i would be happy if you update me the events going on our area,recommendation_events,would happy update events going area
6830,what's happening here,recommendation_events,what's happening
6831,list local ongoing exhibitions,recommendation_events,list local ongoing exhibitions
6832,local show,recommendation_events,local show
6833,what movie can i watch tonight on the theater here in boston,recommendation_events,movie watch tonight theater boston
6834,list events nearby new york,recommendation_events,list events nearby new york
6835,what is going on in me area today,recommendation_events,going area today
6836,please show me a list of entertainment options in my area,recommendation_events,please show list entertainment options area
6837,what happens on the fourth of july,recommendation_events,happens fourth july
6838,what is worth doing around here,recommendation_events,worth around
6839,things to do in my area,recommendation_events,things area
6840,what bands are playing in town this weekend,recommendation_events,bands playing town weekend
6841,where is the event venue,recommendation_events,event venue
6842,what events are going on around my place,recommendation_events,events going around place
6843,what kind of free activities can i do locally this week,recommendation_events,kind free activities locally week
6844,list events in ny,recommendation_events,list events ny
6845,what is going on around me,recommendation_events,going around
6846,what plays are showing at the theatre,recommendation_events,plays showing theatre
6847,what should i do this weekend,recommendation_events,weekend
6848,tell me all local events,recommendation_events,tell local events
6849,any activity in the area,recommendation_events,activity area
6850,i want to know what are happening now in me area,recommendation_events,want know happening area
6851,is there any concerts taking place in new york today,recommendation_events,concerts taking place new york today
6852,what's going on around the neighborhood,recommendation_events,what's going around neighborhood
6853,what's happening in my town,recommendation_events,what's happening town
6854,whats happening in ny,recommendation_events,whats happening ny
6855,what events are going in my town this week,recommendation_events,events going town week
6856,show local events near me,recommendation_events,show local events near
6857,i need all the local events for this area that are being held this weekend,recommendation_events,need local events area held weekend
6858,any specific event in washington,recommendation_events,specific event washington
6859,what events are going on in the area,recommendation_events,events going area
6860,what is going on today in biloxi,recommendation_events,going today biloxi
6861,running competitions on the west side,recommendation_events,running competitions west side
6862,what events are in me area,recommendation_events,events area
6863,local events,recommendation_events,local events
6864,to which event can i go in milan now,recommendation_events,event go milan
6865,what gun shows are in tulsa,recommendation_events,gun shows tulsa
6866,Show current local events,recommendation_events,Show current local events
6867,today's local events,recommendation_events,today's local events
6868,is there anything special going on nearby,recommendation_events,anything special going nearby
6869,can you tell me about any local events coming up,recommendation_events,tell local events coming
6870,search events and meetups for central park west,recommendation_events,search events meetups central park west
6871,which book fair events are taking place next week in washington dc,recommendation_events,book fair events taking place next week washington dc
6872,any festivals in town at this time or in the coming week,recommendation_events,festivals town time coming week
6873,what's around tonight,recommendation_events,what's around tonight
6874,any local activities you can recommend in my area,recommendation_events,local activities recommend area
6875,please show me best run program in jodhpur,recommendation_events,please show best run program jodhpur
6876,show todays events in ny,recommendation_events,show todays events ny
6877,are there any events going on nearby,recommendation_events,events going nearby
6878,what is happening now,recommendation_events,happening
6879,what is open late in la,recommendation_events,open late la
6880,when does panama city mall open,recommendation_events,panama city mall open
6881,tell me about the events going on around my location,recommendation_events,tell events going around location
6882,show me concerts in sacramento,recommendation_events,show concerts sacramento
6883,what is this event is called which happening my area,recommendation_events,event called happening area
6884,are there any events happening this weekend,recommendation_events,events happening weekend
6885,anything unique to do in the city today,recommendation_events,anything unique city today
6886,what can i do in charlotte,recommendation_events,charlotte
6887,what's going on around here this weekend,recommendation_events,what's going around weekend
6888,please search for local events,recommendation_events,please search local events
6889,show me events in sacramento,recommendation_events,show events sacramento
6890,tell me all events for today in my city,recommendation_events,tell events today city
6891,are there any events coming up,recommendation_events,events coming
6892,what bands are playing close by,recommendation_events,bands playing close
6893,what is happening near me,recommendation_events,happening near
6894,show me where i can find a hamburger,recommendation_events,show find hamburger
6895,what are the events taking place in new york today,recommendation_events,events taking place new york today
6896,is there anything happening on jazz scene around edinburgh,recommendation_events,anything happening jazz scene around edinburgh
6897,which pubs participate in the jazz festival,recommendation_events,pubs participate jazz festival
6898,what activities are taking place in my area,recommendation_events,activities taking place area
6899,what is going on in south tampa today,recommendation_events,going south tampa today
6900,can you recommend some dog's how events going on in our city,recommendation_events,recommend dog's events going city
6901,any free events in la today,recommendation_events,free events la today
6902,what's interesting around here,recommendation_events,what's interesting around
6903,where should i go this weekend,recommendation_events,go weekend
6904,what's going on tonight in sacramento,recommendation_events,what's going tonight sacramento
6905,which teams are playing this weekend,recommendation_events,teams playing weekend
6906,are there any events going on in milan,recommendation_events,events going milan
6907,find the events,recommendation_events,find events
6908,could you suggest some fun in new york,recommendation_events,could suggest fun new york
6909,Show latest events around new york,recommendation_events,Show latest events around new york
6910,show me upcoming events in the quad cities,recommendation_events,show upcoming events quad cities
6911,are there any events happening in town,recommendation_events,events happening town
6912,do i need to undertake any particular activity during my stay at the yellowstone national park,recommendation_events,need undertake particular activity stay yellowstone national park
6913,tell me all the current events in my hometown,recommendation_events,tell current events hometown
6914,any cultural events in california,recommendation_events,cultural events california
6915,are there any events going on close by,recommendation_events,events going close
6916,what are the local concerts tonight,recommendation_events,local concerts tonight
6917,what is the event name going in me area,recommendation_events,event name going area
6918,where should i go for dinner in san francisco tonight,recommendation_events,go dinner san francisco tonight
6919,what is happening tomorrow,recommendation_events,happening tomorrow
6920,what type of event,recommendation_events,type event
6921,fun things to do today,recommendation_events,fun things today
6922,show me events nearby,recommendation_events,show events nearby
6923,find events in local area,recommendation_events,find events local area
6924,refer local current events,recommendation_events,refer local current events
6925,show me upcoming events in this area,recommendation_events,show upcoming events area
6926,what events are happening in los angeles,recommendation_events,events happening los angeles
6927,what is planned for today in my local area,recommendation_events,planned today local area
6928,what is going on around here,recommendation_events,going around
6929,what's happening around me,recommendation_events,what's happening around
6930,whats the best place to eat near here,recommendation_locations,whats best place eat near
6931,whats around,recommendation_locations,whats around
6932,show shops around second street,recommendation_locations,show shops around second street
6933,what's the best chicken place near me,recommendation_locations,what's best chicken place near
6934,where is the best pizza on sixth street,recommendation_locations,best pizza sixth street
6935,find a shop that sells beer,recommendation_locations,find shop sells beer
6936,what stores have clearance,recommendation_locations,stores clearance
6937,please look up local restaurants that are open now,recommendation_locations,please look local restaurants open
6938,what pubs are close to me,recommendation_locations,pubs close
6939,what is a good lave to eat near me,recommendation_locations,good lave eat near
6940,i need to know where to get chicken wings in benton ar,recommendation_locations,need know get chicken wings benton ar
6941,can you find me a furniture store near me,recommendation_locations,find furniture store near
6942,list of the nearby restaurant,recommendation_locations,list nearby restaurant
6943,whats a good place to eat around midtown new york,recommendation_locations,whats good place eat around midtown new york
6944,are there any shopping centers nearby,recommendation_locations,shopping centers nearby
6945,where is a good wine bar near me,recommendation_locations,good wine bar near
6946,i want to find some chinese food what is near me,recommendation_locations,want find chinese food near
6947,where is a theatre in my area,recommendation_locations,theatre area
6948,recommend a local steak restaurant,recommendation_locations,recommend local steak restaurant
6949,near by grocery,recommendation_locations,near grocery
6950,what mexican food is around me,recommendation_locations,mexican food around
6951,tell me where i can go shopping in this area,recommendation_locations,tell go shopping area
6952,where is the closest sweet frog,recommendation_locations,closest sweet frog
6953,near by super market,recommendation_locations,near super market
6954,best bar in local area,recommendation_locations,best bar local area
6955,locate local pizza shops,recommendation_locations,locate local pizza shops
6956,what restaurants around here have good reviews,recommendation_locations,restaurants around good reviews
6957,show me thai food near me,recommendation_locations,show thai food near
6958,where can i get something to eat by the art museum,recommendation_locations,get something eat art museum
6959,list all the nearby shops,recommendation_locations,list nearby shops
6960,recommend a restaurant with medium expense,recommendation_locations,recommend restaurant medium expense
6961,where is the best mechanic in eagle point,recommendation_locations,best mechanic eagle point
6962,find me the oldest hotel in washington dc,recommendation_locations,find oldest hotel washington dc
6963,how many grocery stores are located in my neighborhood,recommendation_locations,many grocery stores located neighborhood
6964,i want to know what supermarket near me has the best price on gluten free bread,recommendation_locations,want know supermarket near best price gluten free bread
6965,give me all ice cream shops within two miles,recommendation_locations,give ice cream shops within two miles
6966,where is the nearest atm machine,recommendation_locations,nearest atm machine
6967,nearest restaurants available at this time,recommendation_locations,nearest restaurants available time
6968,where i can find a bakery,recommendation_locations,find bakery
6969,where is the nearest pub in the city,recommendation_locations,nearest pub city
6970,are there any veg restaurants in phoenix,recommendation_locations,veg restaurants phoenix
6971,tea shop,recommendation_locations,tea shop
6972,list the shops near me,recommendation_locations,list shops near
6973,recommend me some shops to shopping in angel,recommendation_locations,recommend shops shopping angel
6974,where's the best and most affordable place to stay in san diego,recommendation_locations,where's best affordable place stay san diego
6975,where is a walking trail near me,recommendation_locations,walking trail near
6976,will the fast food shop at the corner open today,recommendation_locations,fast food shop corner open today
6977,where is a good place to eat cheap pakistani food,recommendation_locations,good place eat cheap pakistani food
6978,where is the nearest olive garden,recommendation_locations,nearest olive garden
6979,What's close by for dinner,recommendation_locations,What's close dinner
6980,which is the best place to visit in this month,recommendation_locations,best place visit month
6981,have any suggestions for local italian food,recommendation_locations,suggestions local italian food
6982,search for nearby chinese restaurants,recommendation_locations,search nearby chinese restaurants
6983,find shoe shopping near my home,recommendation_locations,find shoe shopping near home
6984,find me a bar in cleveland open until two am,recommendation_locations,find bar cleveland open two
6985,markets near by,recommendation_locations,markets near
6986,what's around me,recommendation_locations,what's around
6987,give me the name of all the shops in my area,recommendation_locations,give name shops area
6988,can you find a nice restaurant downtown,recommendation_locations,find nice restaurant downtown
6989,i'm looking for some dress shows can you find clothing stores within one mile,recommendation_locations,i'm looking dress shows find clothing stores within one mile
6990,can you tell me the cheapest place to get ground beef,recommendation_locations,tell cheapest place get ground beef
6991,where can i shop as a local tourist,recommendation_locations,shop local tourist
6992,what is the best italian restaurant around here,recommendation_locations,best italian restaurant around
6993,what are some good restaurants near by,recommendation_locations,good restaurants near
6994,find a grocery store in town that carries creamed pickled herring,recommendation_locations,find grocery store town carries creamed pickled herring
6995,get me a local restaurant,recommendation_locations,get local restaurant
6996,locate nearby dining places,recommendation_locations,locate nearby dining places
6997,what are the best italian restaurants in los angeles,recommendation_locations,best italian restaurants los angeles
6998,please look up clothing stores near me,recommendation_locations,please look clothing stores near
6999,where is the nearest restaurant here,recommendation_locations,nearest restaurant
7000,find tacos near my home,recommendation_locations,find tacos near home
7001,tell me my choices for a good steak restaurant near here,recommendation_locations,tell choices good steak restaurant near
7002,which store's got the cheapest three pound beef rump,recommendation_locations,store's got cheapest three pound beef rump
7003,what is the best shop restaurant around angel,recommendation_locations,best shop restaurant around angel
7004,which is the nearest restaurants available,recommendation_locations,nearest restaurants available
7005,mobile shop,recommendation_locations,mobile shop
7006,what's the most popular curry place in town,recommendation_locations,what's popular curry place town
7007,tell me pizza restaurants close by,recommendation_locations,tell pizza restaurants close
7008,i would like to know the best rating pubs in the local area,recommendation_locations,would like know best rating pubs local area
7009,can you tell me a good place to eat,recommendation_locations,tell good place eat
7010,where to buy cannon cameras,recommendation_locations,buy cannon cameras
7011,tell me chinese restaurants in the area,recommendation_locations,tell chinese restaurants area
7012,please list the best clothing shops near me,recommendation_locations,please list best clothing shops near
7013,hey olly tell me what shops i am near,recommendation_locations,hey olly tell shops near
7014,what shops are round here,recommendation_locations,shops round
7015,list shops in douglasville ga,recommendation_locations,list shops douglasville ga
7016,ask a restaurant in me area,recommendation_locations,ask restaurant area
7017,find me the smallest coffee shop in new orleans,recommendation_locations,find smallest coffee shop new orleans
7018,give the list of theaters in the vicinity,recommendation_locations,give list theaters vicinity
7019,what are the vietnamese restaurants in the area,recommendation_locations,vietnamese restaurants area
7020,what's the best pizza shop nearby,recommendation_locations,what's best pizza shop nearby
7021,what's the best clothes store here,recommendation_locations,what's best clothes store
7022,when does olive garden close today,recommendation_locations,olive garden close today
7023,best restaurant in local area,recommendation_locations,best restaurant local area
7024,where a good restaurant,recommendation_locations,good restaurant
7025,where's the closest zoo to where i'm at,recommendation_locations,where's closest zoo i'm
7026,where can i shop around here,recommendation_locations,shop around
7027,any good bike shops in oxford,recommendation_locations,good bike shops oxford
7028,where can i go shopping here,recommendation_locations,go shopping
7029,tell me what is the nicest place to go,recommendation_locations,tell nicest place go
7030,is there any grocery nearby,recommendation_locations,grocery nearby
7031,where is a nearby park where i can go running,recommendation_locations,nearby park go running
7032,show me all the shops that i can find in milan,recommendation_locations,show shops find milan
7033,find local shops,recommendation_locations,find local shops
7034,help me locate a shop that sells clothes for classy ladies,recommendation_locations,help locate shop sells clothes classy ladies
7035,what train companies are near me,recommendation_locations,train companies near
7036,i need a good shop,recommendation_locations,need good shop
7037,please give me all shop names in a two mile radius,recommendation_locations,please give shop names two mile radius
7038,which shops can i find in milan,recommendation_locations,shops find milan
7039,please find the most popular store in the area,recommendation_locations,please find popular store area
7040,i need a place that will deliver pizza to me in benton ar,recommendation_locations,need place deliver pizza benton ar
7041,wine shop,recommendation_locations,wine shop
7042,can you tell me about expensive sushi restaurants in west philadelphia,recommendation_locations,tell expensive sushi restaurants west philadelphia
7043,where is the nearest smoke shop,recommendation_locations,nearest smoke shop
7044,i want to know the best super market in this local area,recommendation_locations,want know best super market local area
7045,i need some sushi what's closest,recommendation_locations,need sushi what's closest
7046,what bars are around me,recommendation_locations,bars around
7047,what's the best italian restaurant in atlanta,recommendation_locations,what's best italian restaurant atlanta
7048,where is the closest bar,recommendation_locations,closest bar
7049,please list shops within one miles from me,recommendation_locations,please list shops within one miles
7050,where is a great pub,recommendation_locations,great pub
7051,where should i go for mexican food in me area,recommendation_locations,go mexican food area
7052,recommend pub in eighth and monte diablo,recommendation_locations,recommend pub eighth monte diablo
7053,what pubs are close,recommendation_locations,pubs close
7054,name stores within ten mile radius with music,recommendation_locations,name stores within ten mile radius music
7055,what restaurants are open near me,recommendation_locations,restaurants open near
7056,where can i go shopping in this area,recommendation_locations,go shopping area
7057,where can i find a good taco truck in los angles,recommendation_locations,find good taco truck los angles
7058,what is a good place for cruise,recommendation_locations,good place cruise
7059,what chinese restaurants are in my area,recommendation_locations,chinese restaurants area
7060,where do people shop for clothes here,recommendation_locations,people shop clothes
7061,can you recommend a cheap restaurant in this area,recommendation_locations,recommend cheap restaurant area
7062,make a reservation for two at olive garden,recommendation_locations,make reservation two olive garden
7063,show me some vegan restaurants close by,recommendation_locations,show vegan restaurants close
7064,where monet's exhibition takes place,recommendation_locations,monet's exhibition takes place
7065,show me reviews of my nearest location food court,recommendation_locations,show reviews nearest location food court
7066,are there any grocery stores nearby,recommendation_locations,grocery stores nearby
7067,show me some food court nearest to my location,recommendation_locations,show food court nearest location
7068,can you recommend good stores in this area,recommendation_locations,recommend good stores area
7069,are there any good pizza places around here,recommendation_locations,good pizza places around
7070,what is the best mexican restaurant in seattle,recommendation_locations,best mexican restaurant seattle
7071,list all the shops that are located in milan,recommendation_locations,list shops located milan
7072,find me a nice restaurant for dinner,recommendation_locations,find nice restaurant dinner
7073,i'm looking for a bar do you know a good one,recommendation_locations,i'm looking bar know good one
7074,where is the closest kroger,recommendation_locations,closest kroger
7075,i wish to go for cheap shopping is there any dollars shop nearby,recommendation_locations,wish go cheap shopping dollars shop nearby
7076,display nearby places,recommendation_locations,display nearby places
7077,recommend me a restaurant in west chester,recommendation_locations,recommend restaurant west chester
7078,any farm markets around with local products,recommendation_locations,farm markets around local products
7079,where can i get organic wheat,recommendation_locations,get organic wheat
7080,local shops,recommendation_locations,local shops
7081,where is the nearest italian restaurant,recommendation_locations,nearest italian restaurant
7082,where can i get shawarma in this area,recommendation_locations,get shawarma area
7083,tell me a nice chinese restaurant,recommendation_locations,tell nice chinese restaurant
7084,is there a well rated pizza place between fourteenth and eighteenth streets,recommendation_locations,well rated pizza place fourteenth eighteenth streets
7085,i want to take karate classes where are local karate studios,recommendation_locations,want take karate classes local karate studios
7086,where is a petrol station in five mile radius,recommendation_locations,petrol station five mile radius
7087,is there any salon in babaji nagar,recommendation_locations,salon babaji nagar
7088,find me the cheapest place to buy a new backpack,recommendation_locations,find cheapest place buy new backpack
7089,what restaurant is open after midnight,recommendation_locations,restaurant open midnight
7090,what clothes store would you recommend here,recommendation_locations,clothes store would recommend
7091,please recommend a restaurant in seattle,recommendation_locations,please recommend restaurant seattle
7092,where is a good place to eat in seattle,recommendation_locations,good place eat seattle
7093,i need to find a gift what stores are within a one mile radius,recommendation_locations,need find gift stores within one mile radius
7094,what pubs are near the metro station,recommendation_locations,pubs near metro station
7095,where is the pharmacy in leavenworth,recommendation_locations,pharmacy leavenworth
7096,where can i eat along route sixty six,recommendation_locations,eat along route sixty six
7097,locate me the amazon restaurants,recommendation_locations,locate amazon restaurants
7098,find gluten free bakery near me,recommendation_locations,find gluten free bakery near
7099,which restaurant is there in shivaji nagar,recommendation_locations,restaurant shivaji nagar
