,sentence,intents,clean_sentence
1974,yeah great response to command.,general_affirm,yeah great response command.
1975,yeap exact response to command.,general_affirm,yeap exact response command.
1976,yeap fantastic.,general_affirm,yeap fantastic.
1977,it's amazing.,general_affirm,amazing.
1978,yeah you did it exactly.,general_affirm,yeah exactly.
1979,you've got the answer perfectly.,general_affirm,got answer perfectly.
1980,you've gotten your understanding correcly.,general_affirm,gotten understanding correcly.
1981,yes that's fantastic.,general_affirm,yes that's fantastic.
1982,yes you get your understanding perfectly.,general_affirm,yes get understanding perfectly.
1983,fantastic response to the command.,general_affirm,fantastic response command.
1984,it's perfect.,general_affirm,perfect.
1985,yeap strongly agreed.,general_affirm,yeap strongly agreed.
1986,yes exact response.,general_affirm,yes exact response.
1987,yes that's amazing.,general_affirm,yes that's amazing.
1988,yes great response to the command.,general_affirm,yes great response command.
1989,yeap you've understood the answer right.,general_affirm,yeap understood answer right.
1990,you've done your understanding correcly.,general_affirm,done understanding correcly.
1991,yeap it's good.,general_affirm,yeap good.
1992,exact.,general_affirm,exact.
1993,yeap you have got my instructions exactly.,general_affirm,yeap got instructions exactly.
1994,yes right response.,general_affirm,yes right response.
1995,you have done command exactly.,general_affirm,done command exactly.
1996,command was confirmed.,general_affirm,command confirmed.
1997,yeap you have got my instructions perfectly.,general_affirm,yeap got instructions perfectly.
1998,that's confirmed.,general_affirm,that's confirmed.
1999,you've understood command perfectly.,general_affirm,understood command perfectly.
2000,you understood command exactly.,general_affirm,understood command exactly.
2001,yeap correct response to the command.,general_affirm,yeap correct response command.
2002,yeah it's confirmed.,general_affirm,yeah confirmed.
2003,excellent response to the command.,general_affirm,excellent response command.
2004,that is correct.,general_affirm,correct.
2005,yeah great response.,general_affirm,yeah great response.
2006,good response to command.,general_affirm,good response command.
2007,yeah that's confirmed.,general_affirm,yeah that's confirmed.
2008,yeah exact response.,general_affirm,yeah exact response.
2009,you did it exactly.,general_affirm,exactly.
2010,yes you have understood my instructions perfectly.,general_affirm,yes understood instructions perfectly.
2011,yeah you did the command correcly.,general_affirm,yeah command correcly.
2012,you have done your understanding correcly.,general_affirm,done understanding correcly.
2013,yeap you have got my instructions correcly.,general_affirm,yeap got instructions correcly.
2014,yeap good.,general_affirm,yeap good.
2015,yeah please.,general_affirm,yeah please.
2016,yeap excellent response.,general_affirm,yeap excellent response.
2017,yeap that was wonderful.,general_affirm,yeap wonderful.
2018,yeah you've got my instructions right.,general_affirm,yeah got instructions right.
2019,yes perfectly.,general_affirm,yes perfectly.
2020,yeap good response.,general_affirm,yeap good response.
2021,yeah you've got that perfectly.,general_affirm,yeah got perfectly.
2022,yeap you've done that right.,general_affirm,yeap done right.
2023,yeah answer was correct.,general_affirm,yeah answer correct.
2024,yeap you've got command correcly.,general_affirm,yeap got command correcly.
2025,yeap fantastic response to command.,general_affirm,yeap fantastic response command.
2026,yes you've understood that right.,general_affirm,yes understood right.
2027,yeah fantastic response to command.,general_affirm,yeah fantastic response command.
2028,that is right.,general_affirm,right.
2029,yeap you've understood my instructions perfectly.,general_affirm,yeap understood instructions perfectly.
2030,yeap fantastic response.,general_affirm,yeap fantastic response.
2031,yeap it's confirmed.,general_affirm,yeap confirmed.
2032,yeah that was fantastic.,general_affirm,yeah fantastic.
2033,you did command perfectly.,general_affirm,command perfectly.
2034,you've gotten my instructions exactly.,general_affirm,gotten instructions exactly.
2035,yes you have done that exactly.,general_affirm,yes done exactly.
2036,you got that perfectly.,general_affirm,got perfectly.
2037,yeah you get command exactly.,general_affirm,yeah get command exactly.
2038,yeah you've gotten my instructions right.,general_affirm,yeah gotten instructions right.
2039,wonderful response to command.,general_affirm,wonderful response command.
2040,yeap you've got my instructions correcly.,general_affirm,yeap got instructions correcly.
2041,yeah you've understood my instructions perfectly.,general_affirm,yeah understood instructions perfectly.
2042,yes wonderful response.,general_affirm,yes wonderful response.
2043,yes you got answer correcly.,general_affirm,yes got answer correcly.
2044,yeah amazing response.,general_affirm,yeah amazing response.
2045,yeap you've understood it correcly.,general_affirm,yeap understood correcly.
2046,you have done it perfectly.,general_affirm,done perfectly.
2047,it's right.,general_affirm,right.
2048,yeap right response.,general_affirm,yeap right response.
2049,yeap you've gotten that correcly.,general_affirm,yeap gotten correcly.
2050,yes you have done it exactly.,general_affirm,yes done exactly.
2051,you have got my instructions right.,general_affirm,got instructions right.
2052,yeap perfect.,general_affirm,yeap perfect.
2053,you understood the answer right.,general_affirm,understood answer right.
2054,yes wonderful response to command.,general_affirm,yes wonderful response command.
2055,yes it's confirmed.,general_affirm,yes confirmed.
2056,you understood command perfectly.,general_affirm,understood command perfectly.
2057,confirmed.,general_affirm,confirmed.
2058,yeah you have got your understanding perfectly.,general_affirm,yeah got understanding perfectly.
2059,yeap right.,general_affirm,yeap right.
2060,yeah you have got my instructions right.,general_affirm,yeah got instructions right.
2061,yeap correcly.,general_affirm,yeap correcly.
2062,yes right.,general_affirm,yes right.
2063,you have gotten that exactly.,general_affirm,gotten exactly.
2064,yeap it was correct.,general_affirm,yeap correct.
2065,yeap that's correct.,general_affirm,yeap that's correct.
2066,yes it was perfect.,general_affirm,yes perfect.
2067,olly please will you shut off.,general_commandstop,olly please shut off.
2068,olly please shut down.,general_commandstop,olly please shut down.
2069,olly would you please shut up.,general_commandstop,olly would please shut up.
2070,olly please will you shut up.,general_commandstop,olly please shut up.
2071,will you stop please.,general_commandstop,stop please.
2072,please would you cancel.,general_commandstop,please would cancel.
2073,i will talk to you later on.,general_commandstop,talk later on.
2074,can you please shut up.,general_commandstop,please shut up.
2075,olly will you stop it.,general_commandstop,olly stop it.
2076,olly please cancel.,general_commandstop,olly please cancel.
2077,i would talk to you later.,general_commandstop,would talk later.
2078,olly that would be all.,general_commandstop,olly would all.
2079,"olly that is enough, cancel.",general_commandstop,"olly enough, cancel."
2080,i'd like you just stop.,general_commandstop,i'd like stop.
2081,please will you shut off.,general_commandstop,please shut off.
2082,olly shut down.,general_commandstop,olly shut down.
2083,cancel.,general_commandstop,cancel.
2084,please can you stop it.,general_commandstop,please stop it.
2085,"olly that's all, stop it.",general_commandstop,"olly that's all, stop it."
2086,i'd like you just cancel.,general_commandstop,i'd like cancel.
2087,olly will you shut up please.,general_commandstop,olly shut please.
2088,"that's enough, stop it.",general_commandstop,"that's enough, stop it."
2089,olly could you stop.,general_commandstop,olly could stop.
2090,please will you shut up.,general_commandstop,please shut up.
2091,i want you just stop it.,general_commandstop,want stop it.
2092,would you just stop it please.,general_commandstop,would stop please.
2093,will you just stop please.,general_commandstop,stop please.
2094,olly can you just stop it please.,general_commandstop,olly stop please.
2095,will you shut down please.,general_commandstop,shut please.
2096,olly please shut off.,general_commandstop,olly please shut off.
2097,olly stop please.,general_commandstop,olly stop please.
2098,olly just stop please.,general_commandstop,olly stop please.
2099,please could you shut off.,general_commandstop,please could shut off.
2100,please will you shut down.,general_commandstop,please shut down.
2101,would you shut up.,general_commandstop,would shut up.
2102,olly i like you cancel it.,general_commandstop,olly like cancel it.
2103,"that's enough, just cancel.",general_commandstop,"that's enough, cancel."
2104,please would you just cancel it.,general_commandstop,please would cancel it.
2105,olly please can you shut off.,general_commandstop,olly please shut off.
2106,i'd like you cancel it.,general_commandstop,i'd like cancel it.
2107,will you please shut up.,general_commandstop,please shut up.
2108,olly can you cancel please.,general_commandstop,olly cancel please.
2109,"olly that is all, just cancel.",general_commandstop,"olly all, cancel."
2110,i like you stop it.,general_commandstop,like stop it.
2111,olly i want you just stop it.,general_commandstop,olly want stop it.
2112,please shut down.,general_commandstop,please shut down.
2113,would you stop it.,general_commandstop,would stop it.
2114,olly will you shut down please.,general_commandstop,olly shut please.
2115,i would like you stop.,general_commandstop,would like stop.
2116,olly i like you cancel.,general_commandstop,olly like cancel.
2117,please just cancel.,general_commandstop,please cancel.
2118,would you stop.,general_commandstop,would stop.
2119,olly will you cancel it.,general_commandstop,olly cancel it.
2120,olly please would you shut off.,general_commandstop,olly please would shut off.
2121,olly could you shut up please.,general_commandstop,olly could shut please.
2122,"that's enough, stop.",general_commandstop,"that's enough, stop."
2123,olly would you shut up please.,general_commandstop,olly would shut please.
2124,"that is enough, stop it.",general_commandstop,"enough, stop it."
2125,olly i like you just cancel.,general_commandstop,olly like cancel.
2126,please would you cancel it.,general_commandstop,please would cancel it.
2127,just cancel.,general_commandstop,cancel.
2128,please cancel.,general_commandstop,please cancel.
2129,"that's enough, just cancel it.",general_commandstop,"that's enough, cancel it."
2130,"olly that is enough, just cancel.",general_commandstop,"olly enough, cancel."
2131,"that's all, just cancel it.",general_commandstop,"that's all, cancel it."
2132,olly please would you shut down.,general_commandstop,olly please would shut down.
2133,could you please shut down.,general_commandstop,could please shut down.
2134,would you stop please.,general_commandstop,would stop please.
2135,i like you just cancel it.,general_commandstop,like cancel it.
2136,olly talk to you later on.,general_commandstop,olly talk later on.
2137,that would be all.,general_commandstop,would all.
2138,olly could you shut down.,general_commandstop,olly could shut down.
2139,olly will you shut down.,general_commandstop,olly shut down.
2140,can you shut off please.,general_commandstop,shut please.
2141,"that's enough, just stop it.",general_commandstop,"that's enough, stop it."
2142,"that's all, just stop.",general_commandstop,"that's all, stop."
2143,olly will you please shut off.,general_commandstop,olly please shut off.
2144,"olly that is enough, cancel it.",general_commandstop,"olly enough, cancel it."
2145,i will talk to you later.,general_commandstop,talk later.
2146,would you shut up please.,general_commandstop,would shut please.
2147,could you please shut up.,general_commandstop,could please shut up.
2148,olly can you please shut up.,general_commandstop,olly please shut up.
2149,can you shut up please.,general_commandstop,shut please.
2150,"that's all, stop.",general_commandstop,"that's all, stop."
2151,talk to you later.,general_commandstop,talk later.
2152,shut up.,general_commandstop,shut up.
2153,olly will you stop please.,general_commandstop,olly stop please.
2154,"olly that's enough, stop it.",general_commandstop,"olly that's enough, stop it."
2155,can you just stop it please.,general_commandstop,stop please.
2156,olly can you shut off.,general_commandstop,olly shut off.
2157,can you please shut down.,general_commandstop,please shut down.
2158,"olly that's all, just stop.",general_commandstop,"olly that's all, stop."
2159,olly could you just cancel please.,general_commandstop,olly could cancel please.
2160,olly would you shut up.,general_commandstop,olly would shut up.
2161,olly please stop.,general_commandstop,olly please stop.
2162,olly would you shut off please.,general_commandstop,olly would shut please.
2163,just stop please.,general_commandstop,stop please.
2164,please will you just cancel.,general_commandstop,please cancel.
2165,just cancel please.,general_commandstop,cancel please.
2166,olly that will be all.,general_commandstop,olly all.
2167,could you stop please.,general_commandstop,could stop please.
2168,olly please can you just stop it.,general_commandstop,olly please stop it.
2169,olly i would like you stop.,general_commandstop,olly would like stop.
2170,would you shut off please.,general_commandstop,would shut please.
2171,could you shut down.,general_commandstop,could shut down.
2172,i want you cancel.,general_commandstop,want cancel.
2173,"that is all, just cancel.",general_commandstop,"all, cancel."
2174,olly please would you just stop it.,general_commandstop,olly please would stop it.
2175,olly will you please shut down.,general_commandstop,olly please shut down.
2176,"olly that's enough, cancel.",general_commandstop,"olly that's enough, cancel."
2177,could you just cancel.,general_commandstop,could cancel.
2178,olly could you please shut off.,general_commandstop,olly could please shut off.
2179,olly please could you just cancel.,general_commandstop,olly please could cancel.
2180,olly can you shut up.,general_commandstop,olly shut up.
2181,will you shut up.,general_commandstop,shut up.
2182,please can you shut off.,general_commandstop,please shut off.
2183,olly i would like you just cancel it.,general_commandstop,olly would like cancel it.
2184,"olly that's enough, stop.",general_commandstop,"olly that's enough, stop."
2185,i would talk to you later on.,general_commandstop,would talk later on.
2186,i like you just cancel.,general_commandstop,like cancel.
2187,olly will you shut off.,general_commandstop,olly shut off.
2188,please can you cancel it.,general_commandstop,please cancel it.
2189,"olly that is enough, stop it.",general_commandstop,"olly enough, stop it."
2190,would you please shut up.,general_commandstop,would please shut up.
2191,olly can you please shut down.,general_commandstop,olly please shut down.
2192,olly that is enough.,general_commandstop,olly enough.
2193,olly i'd like you just cancel it.,general_commandstop,olly i'd like cancel it.
2194,would you just cancel it please.,general_commandstop,would cancel please.
2195,would you please shut down.,general_commandstop,would please shut down.
2196,"that is all, stop it.",general_commandstop,"all, stop it."
2197,olly would you please shut off.,general_commandstop,olly would please shut off.
2198,i would like you just cancel.,general_commandstop,would like cancel.
2199,olly i will talk to you later.,general_commandstop,olly talk later.
2200,please would you shut up.,general_commandstop,please would shut up.
2201,olly shut up.,general_commandstop,olly shut up.
2202,can you just cancel please.,general_commandstop,cancel please.
2203,olly please could you shut up.,general_commandstop,olly please could shut up.
2204,please shut off.,general_commandstop,please shut off.
2205,could you just cancel it please.,general_commandstop,could cancel please.
2206,olly can you please shut off.,general_commandstop,olly please shut off.
2207,olly please could you shut down.,general_commandstop,olly please could shut down.
2208,olly please just stop.,general_commandstop,olly please stop.
2209,olly would you shut off.,general_commandstop,olly would shut off.
2210,olly that's all.,general_commandstop,olly that's all.
2211,olly i want you cancel it.,general_commandstop,olly want cancel it.
2212,can you shut up.,general_commandstop,shut up.
2213,olly can you shut up please.,general_commandstop,olly shut please.
2214,"that is enough, just cancel it.",general_commandstop,"enough, cancel it."
2215,would you shut off.,general_commandstop,would shut off.
2216,olly just stop.,general_commandstop,olly stop.
2217,olly could you shut off.,general_commandstop,olly could shut off.
2218,olly i want you stop.,general_commandstop,olly want stop.
2219,olly will you stop.,general_commandstop,olly stop.
2220,would you shut down please.,general_commandstop,would shut please.
2221,can you just cancel it.,general_commandstop,cancel it.
2222,olly i would like you just stop it.,general_commandstop,olly would like stop it.
2223,"that is all, just cancel it.",general_commandstop,"all, cancel it."
2224,"that is all, just stop.",general_commandstop,"all, stop."
2225,olly could you please shut up.,general_commandstop,olly could please shut up.
2226,i want you just cancel it.,general_commandstop,want cancel it.
2227,olly please can you cancel.,general_commandstop,olly please cancel.
2228,olly that is all.,general_commandstop,olly all.
2229,"olly that is all, just stop it.",general_commandstop,"olly all, stop it."
2230,olly please just cancel.,general_commandstop,olly please cancel.
2231,could you shut up.,general_commandstop,could shut up.
2232,i like you stop.,general_commandstop,like stop.
2233,that is all.,general_commandstop,all.
2234,olly please could you cancel.,general_commandstop,olly please could cancel.
2235,olly will you just stop it please.,general_commandstop,olly stop please.
2236,"olly that is enough, just cancel it.",general_commandstop,"olly enough, cancel it."
2237,that is enough.,general_commandstop,enough.
2238,will you please shut off.,general_commandstop,please shut off.
2239,i would like you cancel it.,general_commandstop,would like cancel it.
2240,"olly that is all, cancel.",general_commandstop,"olly all, cancel."
2241,shut down please.,general_commandstop,shut please.
2242,confirm the question please.,general_confirm,confirm question please.
2243,confirm last thing said please.,general_confirm,confirm last thing said please.
2244,please check last thing i said.,general_confirm,please check last thing said.
2245,i like you check and confirm last thing i said please.,general_confirm,like check confirm last thing said please.
2246,please confirm it.,general_confirm,please confirm it.
2247,i like you confirm my last command please.,general_confirm,like confirm last command please.
2248,will you check and confirm instruction.,general_confirm,check confirm instruction.
2249,can you check last thing i said please.,general_confirm,check last thing said please.
2250,would you confirm last thing i said please.,general_confirm,would confirm last thing said please.
2251,can you check and confirm detail please.,general_confirm,check confirm detail please.
2252,did you get my last command correctly?,general_confirm,get last command correctly?
2253,would you check and confirm the question please.,general_confirm,would check confirm question please.
2254,please check detail.,general_confirm,please check detail.
2255,can you please confirm what said.,general_confirm,please confirm said.
2256,did you get it correctly?,general_confirm,get correctly?
2257,please confirm my last instruction.,general_confirm,please confirm last instruction.
2258,would you please confirm that.,general_confirm,would please confirm that.
2259,can you check and confirm my last command please.,general_confirm,check confirm last command please.
2260,would you please check and confirm what i last said.,general_confirm,would please check confirm last said.
2261,would you please check my last command.,general_confirm,would please check last command.
2262,could you confirm my last instruction please.,general_confirm,could confirm last instruction please.
2263,could you confirm what i just said please.,general_confirm,could confirm said please.
2264,please will you confirm command.,general_confirm,please confirm command.
2265,will you check and confirm my last command.,general_confirm,check confirm last command.
2266,can you check my last question.,general_confirm,check last question.
2267,check the command.,general_confirm,check command.
2268,can you please check what i last said.,general_confirm,please check last said.
2269,please would you check and confirm it.,general_confirm,please would check confirm it.
2270,could you please check and confirm my last command.,general_confirm,could please check confirm last command.
2271,check that.,general_confirm,check that.
2272,please will you check last thing said.,general_confirm,please check last thing said.
2273,check and confirm what i said please.,general_confirm,check confirm said please.
2274,please check and confirm command.,general_confirm,please check confirm command.
2275,please check and confirm detail.,general_confirm,please check confirm detail.
2276,please check my last question.,general_confirm,please check last question.
2277,i'd like you check details please.,general_confirm,i'd like check details please.
2278,please can you check that.,general_confirm,please check that.
2279,could you please check that.,general_confirm,could please check that.
2280,did you get last thing said correctly?,general_confirm,get last thing said correctly?
2281,would you please check that.,general_confirm,would please check that.
2282,i'd like you to check and confirm last thing said please.,general_confirm,i'd like check confirm last thing said please.
2283,could you check what just said.,general_confirm,could check said.
2284,check and confirm the last thing said please.,general_confirm,check confirm last thing said please.
2285,please check and confirm the last thing said.,general_confirm,please check confirm last thing said.
2286,please check and confirm the command.,general_confirm,please check confirm command.
2287,i want you confirm that please.,general_confirm,want confirm please.
2288,i like you to confirm the details please.,general_confirm,like confirm details please.
2289,did you get the last thing i said correctly?,general_confirm,get last thing said correctly?
2290,could you confirm detail please.,general_confirm,could confirm detail please.
2291,confirm that please.,general_confirm,confirm please.
2292,check and confirm the details please.,general_confirm,check confirm details please.
2293,would you please check instruction.,general_confirm,would please check instruction.
2294,did you get that correctly?,general_confirm,get correctly?
2295,did you get what i just said correctly?,general_confirm,get said correctly?
2296,did you get the last thing said correctly?,general_confirm,get last thing said correctly?
2297,can you check and confirm details.,general_confirm,check confirm details.
2298,could you check and confirm detail please.,general_confirm,could check confirm detail please.
2299,please confirm my last question.,general_confirm,please confirm last question.
2300,please can you check and confirm last thing i said.,general_confirm,please check confirm last thing said.
2301,i would like you check detail please.,general_confirm,would like check detail please.
2302,please will you check and confirm it.,general_confirm,please check confirm it.
2303,confirm the last thing said please.,general_confirm,confirm last thing said please.
2304,would you check what i said.,general_confirm,would check said.
2305,check last thing i said please.,general_confirm,check last thing said please.
2306,i want you to check what just said please.,general_confirm,want check said please.
2307,could you please check what said.,general_confirm,could please check said.
2308,i want you check the last thing i said please.,general_confirm,want check last thing said please.
2309,i would like you to check and confirm my last command please.,general_confirm,would like check confirm last command please.
2310,will you please check and confirm detail.,general_confirm,please check confirm detail.
2311,would you please confirm the last thing i said.,general_confirm,would please confirm last thing said.
2312,can you please check my last question.,general_confirm,please check last question.
2313,i would like you to check what last said please.,general_confirm,would like check last said please.
2314,please can you confirm last thing said.,general_confirm,please confirm last thing said.
2315,could you confirm the question please.,general_confirm,could confirm question please.
2316,would you check and confirm the details please.,general_confirm,would check confirm details please.
2317,please can you check the last thing i said.,general_confirm,please check last thing said.
2318,i would like you check details please.,general_confirm,would like check details please.
2319,can you please check and confirm the detail.,general_confirm,please check confirm detail.
2320,i'd like you check what i last said please.,general_confirm,i'd like check last said please.
2321,would you please check the detail.,general_confirm,would please check detail.
2322,could you please confirm the details.,general_confirm,could please confirm details.
