,sentence,intents,clean_sentence
4375,check my list,lists_query,check list
4376,evaluate today's schedule,lists_query,evaluate today's schedule
4377,make sure bread is on my grocery list,lists_query,make sure bread grocery list
4378,please tell me what lists i have,lists_query,please tell lists
4379,list entry,lists_query,list entry
4380,anything else left on the list,lists_query,anything else left list
4381,what are the jobs to be done today,lists_query,jobs done today
4382,recite the schedules of the list,lists_query,recite schedules list
4383,please read me my current lists,lists_query,please read current lists
4384,read list for me please,lists_query,read list please
4385,check item five on my to do list,lists_query,check item five list
4386,what are my available lists,lists_query,available lists
4387,what all lists are available,lists_query,lists available
4388,can you tell me whats on my shopping list,lists_query,tell whats shopping list
4389,did i add milk to the shopping list,lists_query,add milk shopping list
4390,what lists do i have,lists_query,lists
4391,name the lists available,lists_query,name lists available
4392,find list in my pda,lists_query,find list pda
4393,read available lists,lists_query,read available lists
4394,what lists are available,lists_query,lists available
4395,do i have anything on my to do list,lists_query,anything list
4396,what's the next thing on my list of appointments,lists_query,what's next thing list appointments
4397,what's on my list,lists_query,what's list
4398,tell me items that are on my shopping list,lists_query,tell items shopping list
4399,what items did i plan to buy,lists_query,items plan buy
4400,tell me the name of my lists,lists_query,tell name lists
4401,what items are on my shopping list,lists_query,items shopping list
4402,provide what is there on the list,lists_query,provide list
4403,what do i have on my shopping list,lists_query,shopping list
4404,what is on my playlist of movies on the the dvr,lists_query,playlist movies dvr
4405,what lists do you have on you right now,lists_query,lists right
4406,what do i need to pick up at the grocery store,lists_query,need pick grocery store
4407,what lists do i have queried,lists_query,lists queried
4408,let me know the list,lists_query,let know list
4409,tell me what is in your list,lists_query,tell list
4410,show me my lists,lists_query,show lists
4411,can you tell me what list i have,lists_query,tell list
4412,refresh my list and tell me whats on it,lists_query,refresh list tell whats
4413,open note pad,lists_query,open note pad
4414,what is included in the tour's list,lists_query,included tour's list
4415,tell me about the list,lists_query,tell list
4416,speak all items for to day,lists_query,speak items day
4417,read my grocery list,lists_query,read grocery list
4418,what is on the list for today,lists_query,list today
4419,read my lists to me,lists_query,read lists
4420,tell me what is on my grocery list for this week,lists_query,tell grocery list week
4421,how many events on my list,lists_query,many events list
4422,what are the items on my list,lists_query,items list
4423,put on the screen the lists i have available,lists_query,put screen lists available
4424,List all the lists on this device,lists_query,List lists device
4425,what's on my list to do today,lists_query,what's list today
4426,whats on my list for the time being,lists_query,whats list time
4427,my party list,lists_query,party list
4428,do i have anything lists made for christmas shopping,lists_query,anything lists made christmas shopping
4429,what is on my to do list today,lists_query,list today
4430,tell me what lists i currently have,lists_query,tell lists currently
4431,what are all my lists please,lists_query,lists please
4432,what is on my shopping list,lists_query,shopping list
4433,read that list back to me please,lists_query,read list back please
4434,send me the last list uploaded,lists_query,send last list uploaded
4435,the list contain what,lists_query,list contain
4436,my list please,lists_query,list please
4437,pull up list,lists_query,pull list
4438,i have my clothes list,lists_query,clothes list
4439,how many lists do i have,lists_query,many lists
4440,please show my list,lists_query,please show list
4441,what groups are listed in my contacts,lists_query,groups listed contacts
4442,is there anything left on my list,lists_query,anything left list
4443,list my lists please,lists_query,list lists please
4444,do i have coffee on the grocery list,lists_query,coffee grocery list
4445,do i have anything outstanding on any lists,lists_query,anything outstanding lists
4446,can i see my work lists,lists_query,see work lists
4447,check my to do list,lists_query,check list
4448,what's on my todo list,lists_query,what's todo list
4449,what's my to do list for today,lists_query,what's list today
4450,which lists are present in the notes app,lists_query,lists present notes app
4451,what kind of lists do i have,lists_query,kind lists
4452,display available lists,lists_query,display available lists
4453,how many lists do i have in contacts,lists_query,many lists contacts
4454,give me the names of my lists,lists_query,give names lists
4455,what list do i have,lists_query,list
4456,tell me what is on the list,lists_query,tell list
4457,check out my to do list,lists_query,check list
4458,lists i have,lists_query,lists
4459,tell me what's on my shopping list,lists_query,tell what's shopping list
4460,do i have banana in my shopping list,lists_query,banana shopping list
4461,what are the names of the lists that i have created,lists_query,names lists created
4462,list the lists i have,lists_query,list lists
4463,can i have my list,lists_query,list
4464,do i have anything planned for today,lists_query,anything planned today
4465,what are the titles of the lists in contacts,lists_query,titles lists contacts
4466,what is my list,lists_query,list
4467,read me back whats on my shopping list,lists_query,read back whats shopping list
4468,what on my play list,lists_query,play list
4469,describe your list,lists_query,describe list
4470,what are the names of all my saved lists,lists_query,names saved lists
4471,what is that on the list,lists_query,list
4472,what is on this list,lists_query,list
4473,what to do lists do i have,lists_query,lists
4474,show me what lists are available,lists_query,show lists available
4475,there are anything in my list,lists_query,anything list
4476,what is on my shopping list today,lists_query,shopping list today
4477,what lists available,lists_query,lists available
4478,what is on my to do list,lists_query,list
4479,what's next on my list,lists_query,what's next list
4480,give me all my lists,lists_query,give lists
4481,find the list,lists_query,find list
4482,what lists are in my notebook,lists_query,lists notebook
4483,tell me what lists i have,lists_query,tell lists
4484,list to do,lists_query,list
4485,read out my shopping list for today,lists_query,read shopping list today
4486,what lists are open,lists_query,lists open
4487,what's still on the list,lists_query,what's still list
4488,could you open my list app and check for groceries please,lists_query,could open list app check groceries please
4489,read my list to me,lists_query,read list
4490,please show me the list that i have,lists_query,please show list
4491,give me the details on purchase order,lists_query,give details purchase order
4492,arrange the list in alphabetical order that are available,lists_query,arrange list alphabetical order available
4493,delete the dog list for me,lists_remove,delete dog list
4494,delete item on list,lists_remove,delete item list
4495,remove the milk from the shopping list,lists_remove,remove milk shopping list
4496,please delete list titled kickball,lists_remove,please delete list titled kickball
4497,remove this list from the others,lists_remove,remove list others
4498,please delete the last song that played from the playlist,lists_remove,please delete last song played playlist
4499,remove my grocery list,lists_remove,remove grocery list
4500,take item off list,lists_remove,take item list
4501,please tell me how can I remove the item,lists_remove,please tell I remove item
4502,erase shopping list,lists_remove,erase shopping list
4503,all food items with the prefix dry should be taken away from the list,lists_remove,food items prefix dry taken away list
4504,remove soccer list from notes,lists_remove,remove soccer list notes
4505,remove lunch with co workers on thursday,lists_remove,remove lunch co workers thursday
4506,move buying eggs item to trash from to do list,lists_remove,move buying eggs item trash list
4507,delete that item from the list,lists_remove,delete item list
4508,delete happy dance playlist,lists_remove,delete happy dance playlist
4509,this item should be removed from list,lists_remove,item removed list
4510,i don't want eggs,lists_remove,want eggs
4511,i want you to remove the item from the list,lists_remove,want remove item list
4512,take milk off my grocery list,lists_remove,take milk grocery list
4513,delete the item two from the list,lists_remove,delete item two list
4514,remove a list of employees,lists_remove,remove list employees
4515,take off this list,lists_remove,take list
4516,remove that from my list,lists_remove,remove list
4517,delete that item from my list,lists_remove,delete item list
4518,erase previous list,lists_remove,erase previous list
4519,remove any kind of list,lists_remove,remove kind list
4520,remove grocery list please,lists_remove,remove grocery list please
4521,delete this list,lists_remove,delete list
4522,delete call newspaper from my vacation list,lists_remove,delete call newspaper vacation list
4523,delete bread from shopping list,lists_remove,delete bread shopping list
4524,remove the second row from the list,lists_remove,remove second row list
4525,delete my list of appointments for tomorrow,lists_remove,delete list appointments tomorrow
4526,can you remove my to do list,lists_remove,remove list
4527,open lists remove list,lists_remove,open lists remove list
4528,find my shopping list and delete it,lists_remove,find shopping list delete
4529,i want to cancel the recording i have on the dvr list for this morning,lists_remove,want cancel recording dvr list morning
4530,remove the last item,lists_remove,remove last item
4531,delete the following list,lists_remove,delete following list
4532,cancel list,lists_remove,cancel list
4533,get rid of the wednesday list,lists_remove,get rid wednesday list
4534,show list items,lists_remove,show list items
4535,remove item from list,lists_remove,remove item list
4536,delete shopping list,lists_remove,delete shopping list
4537,remove my list of contacts from work,lists_remove,remove list contacts work
4538,take out the milk from the shopping list,lists_remove,take milk shopping list
4539,delete list for groceries,lists_remove,delete list groceries
4540,remove night night playlist,lists_remove,remove night night playlist
4541,please delete this item,lists_remove,please delete item
4542,delete list blank,lists_remove,delete list blank
4543,please remove item a from my list,lists_remove,please remove item list
4544,remove apple from list,lists_remove,remove apple list
4545,reset my locations list,lists_remove,reset locations list
4546,remove my to do list,lists_remove,remove list
4547,remove the list of person starting from letter m in my contact list,lists_remove,remove list person starting letter contact list
4548,remove my shopping list,lists_remove,remove shopping list
4549,remove apples from my shopping list,lists_remove,remove apples shopping list
4550,remove the list called party time,lists_remove,remove list called party time
4551,kill item,lists_remove,kill item
4552,remove last played song,lists_remove,remove last played song
4553,drop it from list,lists_remove,drop list
4554,please delete the shopping list,lists_remove,please delete shopping list
4555,delete an item,lists_remove,delete item
4556,remove the guest list i created last week,lists_remove,remove guest list created last week
4557,i have already given mark his gift today please remove him on my christmas gift list,lists_remove,already given mark gift today please remove christmas gift list
4558,delete the list,lists_remove,delete list
4559,cross out bread from shopping list,lists_remove,cross bread shopping list
4560,remove noodles from the list,lists_remove,remove noodles list
4561,can you remove remove buying eggs item from my to do list,lists_remove,remove remove buying eggs item list
4562,please remove apples from my grocery list,lists_remove,please remove apples grocery list
4563,delete list,lists_remove,delete list
4564,please clean my shopping list,lists_remove,please clean shopping list
4565,remove list of due payment of rajesh,lists_remove,remove list due payment rajesh
4566,please delete bananas from my shopping list,lists_remove,please delete bananas shopping list
4567,please delete this file,lists_remove,please delete file
4568,take that off there,lists_remove,take
4569,rearrange that off the list,lists_remove,rearrange list
4570,get rid of a list,lists_remove,get rid list
4571,please remove sporty event from list,lists_remove,please remove sporty event list
4572,please remove a list,lists_remove,please remove list
4573,please remove dallas from my travel itinerary,lists_remove,please remove dallas travel itinerary
4574,clear the list,lists_remove,clear list
4575,delete my groceries list,lists_remove,delete groceries list
4576,please remove the first list,lists_remove,please remove first list
4577,remove grocery list,lists_remove,remove grocery list
4578,remove my list of notes from last week,lists_remove,remove list notes last week
4579,find apple on list and remove,lists_remove,find apple list remove
4580,remove that item,lists_remove,remove item
4581,delete last item listed,lists_remove,delete last item listed
4582,remove cereal from my shopping list,lists_remove,remove cereal shopping list
4583,i'm done with today's to do list,lists_remove,i'm done today's list
4584,delete the last list,lists_remove,delete last list
4585,please remove the grocery list from my set of lists,lists_remove,please remove grocery list set lists
4586,clear list things to do this weekend,lists_remove,clear list things weekend
4587,delete everything on the menu,lists_remove,delete everything menu
4588,remove the grocery list from my active lists,lists_remove,remove grocery list active lists
4589,please remove tricep pulldown from my workout list,lists_remove,please remove tricep pulldown workout list
4590,we're out of paint so take bathroom painting off the list,lists_remove,we're paint take bathroom painting list
4591,scratch that one from the list,lists_remove,scratch one list
4592,remove eric name,lists_remove,remove eric name
4593,remove the sms recipient which have initials s,lists_remove,remove sms recipient initials
4594,delete mike stein from contacts list,lists_remove,delete mike stein contacts list
4595,remove milk from my grocery list,lists_remove,remove milk grocery list
4596,eliminate the list kickball but make sure the contacts remain,lists_remove,eliminate list kickball make sure contacts remain
4597,remove the list please,lists_remove,remove list please
4598,delete that item,lists_remove,delete item
4599,remove cart list,lists_remove,remove cart list
4600,remove item three,lists_remove,remove item three
4601,clear my activities list for today,lists_remove,clear activities list today
4602,delete this item,lists_remove,delete item
4603,clear this list,lists_remove,clear list
4604,remove a list please,lists_remove,remove list please
4605,delete sherlock holmes from library,lists_remove,delete sherlock holmes library
4606,i want you to delete my shopping list from last month,lists_remove,want delete shopping list last month
4607,delete item four,lists_remove,delete item four
4608,remove eggs for the shopping list,lists_remove,remove eggs shopping list
4609,remove cheese from my list,lists_remove,remove cheese list
4610,clear list,lists_remove,clear list
4611,get rid of tax list from nineteen ninety,lists_remove,get rid tax list nineteen ninety
4612,remove the item from list,lists_remove,remove item list
4613,delete from playlist my old english songs list,lists_remove,delete playlist old english songs list
4614,erase spaghetti from list,lists_remove,erase spaghetti list
4615,please remove the following list,lists_remove,please remove following list
4616,please remove list,lists_remove,please remove list
4617,abolish an item from list,lists_remove,abolish item list
4618,erase my grocery list,lists_remove,erase grocery list
4619,delete the list created yesterday,lists_remove,delete list created yesterday
4620,remove the santana music list,lists_remove,remove santana music list
4621,delete the shopping list,lists_remove,delete shopping list
4622,delete the list item about the meeting,lists_remove,delete list item meeting
4623,remove vegetables from the list,lists_remove,remove vegetables list
4624,i need you to remove item s from my list,lists_remove,need remove item list
4625,remove a list of accessories purchase last week,lists_remove,remove list accessories purchase last week
4626,remove event from my list,lists_remove,remove event list
4627,delete all lists,lists_remove,delete lists
4628,the list should not contain all food items with the prefix dry,lists_remove,list contain food items prefix dry
4629,get rid of bananas on the list,lists_remove,get rid bananas list
4630,delete the list brads appointments,lists_remove,delete list brads appointments
4631,delete my to do's for this week,lists_remove,delete do's week
4632,delete out item,lists_remove,delete item
4633,trash the open list google,lists_remove,trash open list google
4634,remove list item,lists_remove,remove list item
4635,please clear the list,lists_remove,please clear list
4636,list remove,lists_remove,list remove
4637,remove the list,lists_remove,remove list
4638,i don't need tesco item any more delete it,lists_remove,need tesco item delete
4639,delete my shopping list,lists_remove,delete shopping list
4640,please remove the list,lists_remove,please remove list
4641,delete my list,lists_remove,delete list
4642,remove events from my list,lists_remove,remove events list
4643,remove the bank transaction list,lists_remove,remove bank transaction list
4644,erase that item from my list,lists_remove,erase item list
4645,delete the famous actors list,lists_remove,delete famous actors list
4646,delete my to do list,lists_remove,delete list
4647,clear all from my iphone,lists_remove,clear iphone
4648,throw away my to do list please,lists_remove,throw away list please
4649,remove mike stein from contacts list,lists_remove,remove mike stein contacts list
4650,trash file one,lists_remove,trash file one
4651,remove that event from list,lists_remove,remove event list
4652,find list and remove apple,lists_remove,find list remove apple
4653,delete the list please,lists_remove,delete list please
4654,erase item please from my list,lists_remove,erase item please list
4655,erase the chore list,lists_remove,erase chore list
4656,delete this from list,lists_remove,delete list
4657,remove chores from my to do list,lists_remove,remove chores list
4658,delete shopping from my list,lists_remove,delete shopping list
4659,please delete the list,lists_remove,please delete list
4660,go to the list and remove item,lists_remove,go list remove item
4661,delete butterfly clips from my wish list,lists_remove,delete butterfly clips wish list
4662,i don't need the shopping list delete it,lists_remove,need shopping list delete
4663,get rid of item on the list,lists_remove,get rid item list
4664,delete the last line,lists_remove,delete last line
4665,remove pepper from my grocery list,lists_remove,remove pepper grocery list
4666,remove pencil from stationary,lists_remove,remove pencil stationary
4667,delete the grocery list,lists_remove,delete grocery list
4668,save my last playlist,music_likeness,save last playlist
4669,save this song in my great songs category,music_likeness,save song great songs category
4670,i love the songs of micheal jackson can you save some songs of jackson for me,music_likeness,love songs micheal jackson save songs jackson
4671,i love that song who sings it,music_likeness,love song sings
4672,make this my favorite,music_likeness,make favorite
4673,I love the eternal voice of the singer she is my favourite,music_likeness,I love eternal voice singer favourite
4674,i like a song sing by arijit singh,music_likeness,like song sing arijit singh
4675,the song touches my heart,music_likeness,song touches heart
4676,i like the songs of yeshudas please play it,music_likeness,like songs yeshudas please play
4677,i like this song,music_likeness,like song
4678,save the information which is provided by aman on this song,music_likeness,save information provided aman song
4679,the song makes me remember certain memories,music_likeness,song makes remember certain memories
4680,i have to done it on the post important music file,music_likeness,done post important music file
4681,the song in background is cool,music_likeness,song background cool
4682,please save my rating on this song it is five stars please,music_likeness,please save rating song five stars please
4683,record the opinion of each individual about this song,music_likeness,record opinion individual song
4684,please save my opinion about the song that is currently playing,music_likeness,please save opinion song currently playing
4685,this song is too good,music_likeness,song good
4686,can you save this what a nice song for me,music_likeness,save nice song
4687,please add this song to my playlist favorites,music_likeness,please add song playlist favorites
4688,please note i like jazz and hate disco,music_likeness,please note like jazz hate disco
4689,save this post about the song that i just listened to,music_likeness,save post song listened
4690,add this song to my favorite list,music_likeness,add song favorite list
4691,filter all arijit singh sad song and save or create playlist of sad songs of arijit singh,music_likeness,filter arijit singh sad song save create playlist sad songs arijit singh
4692,i like rock music,music_likeness,like rock music
4693,i like this song please save,music_likeness,like song please save
4694,i like music,music_likeness,like music
4695,please save the remarks i have on this current song,music_likeness,please save remarks current song
4696,you like the song,music_likeness,like song
4697,i like soft rock music,music_likeness,like soft rock music
4698,i like jazz you should know,music_likeness,like jazz know
4699,find lyrics of this song and save it it is very nice song,music_likeness,find lyrics song save nice song
4700,keep that song for when i need cheering up,music_likeness,keep song need cheering
4701,the music of this song is very melodious and relaxing,music_likeness,music song melodious relaxing
4702,i like senatra songs,music_likeness,like senatra songs
4703,love me some brad paisley,music_likeness,love brad paisley
4704,this song is my favourite,music_likeness,song favourite
4705,i'm into music,music_likeness,i'm music
4706,save this channel on pandora please,music_likeness,save channel pandora please
4707,my favorite singer is shakira,music_likeness,favorite singer shakira
4708,add this song to my music,music_likeness,add song music
4709,give five stars to this song,music_likeness,give five stars song
4710,i like justin beibers music please play it,music_likeness,like justin beibers music please play
4711,add that song to my top ten favorites list,music_likeness,add song top ten favorites list
4712,slow rock it's ok,music_likeness,slow rock ok
4713,that's a good song,music_likeness,that's good song
4714,isn't it a lovely song please save this for me,music_likeness,lovely song please save
4715,put that song in my favourite list,music_likeness,put song favourite list
4716,my favourite music band is queen,music_likeness,favourite music band queen
4717,i like jazz,music_likeness,like jazz
4718,please save this song to my favorites,music_likeness,please save song favorites
4719,super song,music_likeness,super song
4720,this song was very good,music_likeness,song good
4721,this is my favorite song,music_likeness,favorite song
4722,i like classic rock,music_likeness,like classic rock
4723,favorite this music,music_likeness,favorite music
4724,i like this song that is playing,music_likeness,like song playing
4725,save this music to my favorites,music_likeness,save music favorites
4726,can save this music in my playlist,music_likeness,save music playlist
4727,save opinion on song,music_likeness,save opinion song
4728,rate this song five stars and save the rating,music_likeness,rate song five stars save rating
4729,save information about love of beyonc,music_likeness,save information love beyonc
4730,replay this song i really like it,music_likeness,replay song really like
4731,please keep everything i have on this song,music_likeness,please keep everything song
4732,nice music,music_likeness,nice music
4733,i like music from when i was a teenager in the,music_likeness,like music teenager
4734,save chhana mereya song in my playlist,music_likeness,save chhana mereya song playlist
4735,please rate current song as five stars,music_likeness,please rate current song five stars
4736,i like r n b,music_likeness,like r n b
4737,add that song to my playlist,music_likeness,add song playlist
4738,save my opinion on adele's song,music_likeness,save opinion adele's song
4739,i am the living blues,music_likeness,living blues
4740,that song was awesome can you repeat,music_likeness,song awesome repeat
4741,save the opinion that i just posted to this song,music_likeness,save opinion posted song
4742,this is a nice song,music_likeness,nice song
4743,save this song as a favorite,music_likeness,save song favorite
