,sentence,intents,clean_sentence
0,what alarms do i have set right now,alarm_query,alarms set right
1,checkout today alarm of meeting,alarm_query,checkout today alarm meeting
2,report alarm settings,alarm_query,report alarm settings
3,see see for me the alarms that you have set tomorrow morning,alarm_query,see see alarms set tomorrow morning
4,is there an alarm for ten am,alarm_query,alarm ten
5,confirm the alarm time,alarm_query,confirm alarm time
6,show my alarms,alarm_query,show alarms
7,at what time have you set alarm for me,alarm_query,time set alarm
8,please list active alarms,alarm_query,please list active alarms
9,please tell me about upcoming alarms,alarm_query,please tell upcoming alarms
10,what alarms have i set for tomorrow,alarm_query,alarms set tomorrow
11,have i set any alarm for today,alarm_query,set alarm today
12,what alarms are upcoming,alarm_query,alarms upcoming
13,what alarms do you have set,alarm_query,alarms set
14,show me all scheduled alarms,alarm_query,show scheduled alarms
15,could you tell me about the alerts i have set,alarm_query,could tell alerts set
16,show me my alarms i have set,alarm_query,show alarms set
17,do i have any alarms for tomorrow morning,alarm_query,alarms tomorrow morning
18,what alarm do i have set for today,alarm_query,alarm set today
19,what alarms have been set for me,alarm_query,alarms set
20,list all set alarms,alarm_query,list set alarms
21,please tell me my alarms,alarm_query,please tell alarms
22,what is the wake up time for my alarm i have set for the flight this weekend,alarm_query,wake time alarm set flight weekend
23,did i set an alarm to wake up in the morning,alarm_query,set alarm wake morning
24,what times do my alarms go off,alarm_query,times alarms go
25,are there any alarms for today,alarm_query,alarms today
26,what time is my wakeup alarm set for,alarm_query,time wakeup alarm set
27,please read out all the alarms that are set,alarm_query,please read alarms set
28,what time are my alarms set for,alarm_query,time alarms set
29,check if default alarm is set,alarm_query,check default alarm set
30,how many alarms do i have set,alarm_query,many alarms set
31,are there any alarms currently set,alarm_query,alarms currently set
32,confirm alarm for tomorrow morning,alarm_query,confirm alarm tomorrow morning
33,do i have an alarm set for morning flight,alarm_query,alarm set morning flight
34,what's my next scheduled alarm,alarm_query,what's next scheduled alarm
35,do i have any alarms set for tomorrow,alarm_query,alarms set tomorrow
36,please check alarms,alarm_query,please check alarms
37,what alarms do i have set,alarm_query,alarms set
38,do i have an alarm set,alarm_query,alarm set
39,show me the list of alarms,alarm_query,show list alarms
40,just to confirm you set the alarm to go off at eight hundred,alarm_query,confirm set alarm go eight hundred
41,did i set my house alarm,alarm_query,set house alarm
42,tell me my alarms,alarm_query,tell alarms
43,what are the next three alarms set to go off,alarm_query,next three alarms set go
44,check if alarm is set for six am,alarm_query,check alarm set six
45,i need to set an alarm how many do i have set,alarm_query,need set alarm many set
46,is the alarm to the backdoor set and ready to go,alarm_query,alarm backdoor set ready go
47,what time do i have my alarm set for tomorrow,alarm_query,time alarm set tomorrow
48,what's the description for the alarm at eleven am,alarm_query,what's description alarm eleven
49,are there any alarms set,alarm_query,alarms set
50,are there any alarms set right now,alarm_query,alarms set right
51,are there any alarms,alarm_query,alarms
52,do i have alarms set for today,alarm_query,alarms set today
53,how many alarms are listed,alarm_query,many alarms listed
54,remind me about my alarms today,alarm_query,remind alarms today
55,list alarms,alarm_query,list alarms
56,do i have alarms set before six in the morning,alarm_query,alarms set six morning
57,how many alarms do i have,alarm_query,many alarms
58,just see for me the alarms that you have set today morning,alarm_query,see alarms set today morning
59,what alarms are on right now,alarm_query,alarms right
60,please tell about the alarms,alarm_query,please tell alarms
61,review set alarms,alarm_query,review set alarms
62,is my work alarm set for tomorrow,alarm_query,work alarm set tomorrow
63,what alarms are set,alarm_query,alarms set
64,what time are my alarms,alarm_query,time alarms
65,which alarms are set in the phone,alarm_query,alarms set phone
66,is my alarm set for tomorrow morning,alarm_query,alarm set tomorrow morning
67,check if any alarm is there after five am,alarm_query,check alarm five
68,what alarms do i have set for thursday,alarm_query,alarms set thursday
69,checkout today set alarm of ten am,alarm_query,checkout today set alarm ten
70,is my school alarm set,alarm_query,school alarm set
71,what alarms do i have scheduled for tomorrow,alarm_query,alarms scheduled tomorrow
72,tell me if my alarm is set for the morning,alarm_query,tell alarm set morning
73,do i have an alarm set for tomorrow,alarm_query,alarm set tomorrow
74,what alarms do i have,alarm_query,alarms
75,when was the last alarm set,alarm_query,last alarm set
76,today how many alarms do i have set,alarm_query,today many alarms set
77,how many alarms do i have set for morning hours between six and nine am,alarm_query,many alarms set morning hours six nine
78,what is tomorrow's alarm time set to,alarm_query,tomorrow's alarm time set
79,please let me know the morning alarm time for weekdays,alarm_query,please let know morning alarm time weekdays
80,can you tell me about the alarm called bed,alarm_query,tell alarm called bed
81,read me my alarms,alarm_query,read alarms
82,is there any alarm after five am,alarm_query,alarm five
83,what are my alarms,alarm_query,alarms
84,what days are my alarms set for,alarm_query,days alarms set
85,would like to know the alarm you sent,alarm_query,would like know alarm sent
86,confirm i have set an alarm for six am,alarm_query,confirm set alarm six
87,what alarms did i set,alarm_query,alarms set
88,what alarms do i got,alarm_query,alarms got
89,show me the alarms that are set,alarm_query,show alarms set
90,tell me about alarms,alarm_query,tell alarms
91,list all the alarms,alarm_query,list alarms
92,checkout today third set alarm,alarm_query,checkout today third set alarm
93,how many alarms are currently set,alarm_query,many alarms currently set
94,are there any alarms set what are they,alarm_query,alarms set
95,is my alarm set,alarm_query,alarm set
96,all alarms,alarm_query,alarms
97,tell me what alarms are set for me,alarm_query,tell alarms set
98,next alarm,alarm_query,next alarm
99,when is the next alarm,alarm_query,next alarm
100,show alarms,alarm_query,show alarms
101,let me know about any alarms set today,alarm_query,let know alarms set today
102,confirm my alarm settings,alarm_query,confirm alarm settings
103,give me the alarm times for the next two days,alarm_query,give alarm times next two days
104,let me know the alarm time,alarm_query,let know alarm time
105,is there any alarm active,alarm_query,alarm active
106,what alarms are set in the house,alarm_query,alarms set house
107,do i have any alarms,alarm_query,alarms
108,have i set any alarms in the morning,alarm_query,set alarms morning
109,check if i have set any alarm for morning,alarm_query,check set alarm morning
110,list all of my upcoming alarms,alarm_query,list upcoming alarms
111,my alarms,alarm_query,alarms
112,do i have any alarms set for six am tomorrow,alarm_query,alarms set six tomorrow
113,how many alarms are currently on my phone,alarm_query,many alarms currently phone
114,any alarms currently listed,alarm_query,alarms currently listed
115,did i remember to set a reminder alarm for my next doctor's appointment,alarm_query,remember set reminder alarm next doctor's appointment
116,what time is set for my wake up alarm,alarm_query,time set wake alarm
117,what alarms are set for this week,alarm_query,alarms set week
118,what is on my alarm schedule,alarm_query,alarm schedule
119,show me all of my active alarms,alarm_query,show active alarms
120,what alarms are currently set,alarm_query,alarms currently set
121,review the alarms i have,alarm_query,review alarms
122,what's the alarm situation for tomorrow,alarm_query,what's alarm situation tomorrow
123,olly find any alarms i have set for today,alarm_query,olly find alarms set today
124,i want to see all set alarms,alarm_query,want see set alarms
125,do i have an alarm set for today,alarm_query,alarm set today
126,at what time is my alarm set,alarm_query,time alarm set
127,can you tell me if i have any alarms set,alarm_query,tell alarms set
128,did I set an alarm to have tablets in the noon,alarm_query,I set alarm tablets noon
129,which alarms do i have,alarm_query,alarms
130,show me the alarms i set,alarm_query,show alarms set
131,what time is my alarm set for,alarm_query,time alarm set
132,is my wake up alarm set a six am,alarm_query,wake alarm set six
133,what home alarms have been set,alarm_query,home alarms set
134,please read me my alarms,alarm_query,please read alarms
135,what times are my alarms set for,alarm_query,times alarms set
136,when will my alarm go off in the morning,alarm_query,alarm go morning
137,do i have any alarms set for today,alarm_query,alarms set today
138,show me what alarm times i've set for the week,alarm_query,show alarm times i've set week
139,list current set alarms,alarm_query,list current set alarms
140,are there any alarms going off today,alarm_query,alarms going today
141,what alarms do i all have set,alarm_query,alarms set
142,show me the alarms i've set,alarm_query,show alarms i've set
143,my set alarms,alarm_query,set alarms
144,what alarms will wake me up tomorrow,alarm_query,alarms wake tomorrow
145,have i got any alarms set,alarm_query,got alarms set
146,what alarms i have set,alarm_query,alarms set
147,tell me about the alarm timings,alarm_query,tell alarm timings
148,alarms,alarm_query,alarms
149,when does my alarm go off,alarm_query,alarm go
150,would you please check to see if i've set my alarm for tomorrow morning,alarm_query,would please check see i've set alarm tomorrow morning
151,alarm status,alarm_query,alarm status
152,what time have you set the alarm,alarm_query,time set alarm
153,list my different alarm,alarm_query,list different alarm
154,what time i am waking up tomorrow,alarm_query,time waking tomorrow
155,what alarms did i set today,alarm_query,alarms set today
156,what alarms are coming up,alarm_query,alarms coming
157,if there any alarm is set then let me know,alarm_query,alarm set let know
158,review all alarms,alarm_query,review alarms
159,is the alarm set for tomorrow morning,alarm_query,alarm set tomorrow morning
160,what time is alarm set for,alarm_query,time alarm set
161,do i have alarms set,alarm_query,alarms set
162,what time is my alarm set for tomorrow morning,alarm_query,time alarm set tomorrow morning
163,is my reminder alarm set for dance class,alarm_query,reminder alarm set dance class
164,when is my alarm set for,alarm_query,alarm set
165,what time will my alarm wake me up,alarm_query,time alarm wake
166,how many alarms are set,alarm_query,many alarms set
167,how many alarms have i set,alarm_query,many alarms set
168,what time will my alarm go off today,alarm_query,time alarm go today
169,please let me know the alarm kept for tuesday's meeting,alarm_query,please let know alarm kept tuesday's meeting
170,did you set the alarm for five am,alarm_query,set alarm five
171,let me know about the alarms you set,alarm_query,let know alarms set
172,what alarms do i have set for today,alarm_query,alarms set today
173,what's my next alarm,alarm_query,what's next alarm
174,let me see my alarms,alarm_query,let see alarms
175,Set a alarm for the day,alarm_set,Set alarm day
176,set an alarm for tomorrow at six in the morning,alarm_set,set alarm tomorrow six morning
177,put an alarm and wake me up at six am tomorrow morning,alarm_set,put alarm wake six tomorrow morning
178,set alarm at five am,alarm_set,set alarm five
179,update alarm,alarm_set,update alarm
180,set new alarm on five am,alarm_set,set new alarm five
181,please set alarm for,alarm_set,please set alarm
182,please arrange to wake me up at three am alarm,alarm_set,please arrange wake three alarm
183,set the alarm for tomorrow five am,alarm_set,set alarm tomorrow five
184,set an alarm for me at eight am,alarm_set,set alarm eight
185,set alarm tomorrow at six am,alarm_set,set alarm tomorrow six
186,set an alarm forty minutes from now,alarm_set,set alarm forty minutes
187,set an alarm for me for tomorrow at seven pm,alarm_set,set alarm tomorrow seven pm
188,set an alarm for two pm,alarm_set,set alarm two pm
189,set an alarm for five minutes from now,alarm_set,set alarm five minutes
190,set alarm for tomorrow morning at six am,alarm_set,set alarm tomorrow morning six
191,i want an alarm for three today,alarm_set,want alarm three today
192,set alarm at nine am on next sunday,alarm_set,set alarm nine next sunday
193,set alarm for eight am,alarm_set,set alarm eight
194,set a continuous alarm without the option to snooze for seven am please,alarm_set,set continuous alarm without option snooze seven please
195,make an alarm for the meeting with bob at seven today,alarm_set,make alarm meeting bob seven today
196,please set an alarm for tomorrows meeting at seven am,alarm_set,please set alarm tomorrows meeting seven
197,set an alarm for eight pm,alarm_set,set alarm eight pm
198,set my calendar for an alarm at five pm tuesday,alarm_set,set calendar alarm five pm tuesday
199,turn my morning alarm on,alarm_set,turn morning alarm
200,tell me when it is five pm,alarm_set,tell five pm
201,two pm set,alarm_set,two pm set
202,set alarm for six am tomorrow,alarm_set,set alarm six tomorrow
203,set up an alarm clock at one pm,alarm_set,set alarm clock one pm
204,i need to get up at seven am,alarm_set,need get seven
205,i need to get going at eight am tomorrow set up an alarm thirty minutes before that,alarm_set,need get going eight tomorrow set alarm thirty minutes
206,let me know when it is ten,alarm_set,let know ten
207,create an alarm for five pm,alarm_set,create alarm five pm
208,set the alarm for five am,alarm_set,set alarm five
209,set alarm of every tuesday of march month morning eight am,alarm_set,set alarm every tuesday march month morning eight
210,repeat alarm,alarm_set,repeat alarm
211,please set the alarm for seven,alarm_set,please set alarm seven
212,wake me up at six am,alarm_set,wake six
213,set a new alarm for that time,alarm_set,set new alarm time
214,ensure i have to get up at six in morning,alarm_set,ensure get six morning
215,set alarm for one hour from now,alarm_set,set alarm one hour
216,schedule an alarm for next weeks dentist appointment,alarm_set,schedule alarm next weeks dentist appointment
217,alarm for ten am,alarm_set,alarm ten
218,please we're the following alarm,alarm_set,please we're following alarm
219,set an alarm for one pm,alarm_set,set alarm one pm
220,set an alarm for the dance classes two hours before the classes start,alarm_set,set alarm dance classes two hours classes start
221,set my alarm for twelve pm,alarm_set,set alarm twelve pm
222,wake me up at five am,alarm_set,wake five
223,set the alarm tone,alarm_set,set alarm tone
224,olly set my alarm to go off in an hour,alarm_set,olly set alarm go hour
225,send me a wake up alert at seven am tomorrow morning,alarm_set,send wake alert seven tomorrow morning
226,please wake me up at eight am,alarm_set,please wake eight
227,make an alarm for four pm,alarm_set,make alarm four pm
228,wake me up at four am,alarm_set,wake four
229,fix an alarm,alarm_set,fix alarm
230,set an alarm for seven am,alarm_set,set alarm seven
231,set alarm for this event reminder repeating for ten times,alarm_set,set alarm event reminder repeating ten times
232,set an alert for two pm,alarm_set,set alert two pm
233,i need to get up at ten tomorrow,alarm_set,need get ten tomorrow
234,get me up at eight am,alarm_set,get eight
235,set alarm for tomorrow at two pm,alarm_set,set alarm tomorrow two pm
236,wake me up at six thirty,alarm_set,wake six thirty
237,please set my alarm clock for eight am,alarm_set,please set alarm clock eight
238,set an alarm for next tuesdays meeting,alarm_set,set alarm next tuesdays meeting
239,set alarm at ten am,alarm_set,set alarm ten
240,please create a new alarm,alarm_set,please create new alarm
241,alert me at three pm to goto the concert,alarm_set,alert three pm goto concert
242,make a new alarm,alarm_set,make new alarm
243,please set a reminder alarm for three pm on Saturday,alarm_set,please set reminder alarm three pm Saturday
244,open clock,alarm_set,open clock
245,set alarm for tomorrow six am,alarm_set,set alarm tomorrow six
246,set my alarm for tuesday at six pm,alarm_set,set alarm tuesday six pm
247,alert me at five hours,alarm_set,alert five hours
248,one am set,alarm_set,one set
249,set alarm to begin,alarm_set,set alarm begin
250,set the alarm for nine am on weekends,alarm_set,set alarm nine weekends
251,add an alarm for tomorrow morning at six am,alarm_set,add alarm tomorrow morning six
252,please set an alarm at six am,alarm_set,please set alarm six
253,set an alarm for tomorrow morning at eight,alarm_set,set alarm tomorrow morning eight
254,ring the alarm when i get home,alarm_set,ring alarm get home
255,set my alarm for time,alarm_set,set alarm time
256,set an alarm for ten o'clock tomorrow morning,alarm_set,set alarm ten o'clock tomorrow morning
257,alarm set,alarm_set,alarm set
258,i want an alarm for six am everyday,alarm_set,want alarm six everyday
259,add a five am alarm in place of my nine pm alarm,alarm_set,add five alarm place nine pm alarm
260,remind me at one thousand three hundred,alarm_set,remind one thousand three hundred
261,alarm,alarm_set,alarm
262,make an alarm,alarm_set,make alarm
263,please set alarm for all days,alarm_set,please set alarm days
264,wake me up at seven am,alarm_set,wake seven
265,is my alarm set for seven am,alarm_set,alarm set seven
266,can you set an alarm for me,alarm_set,set alarm
267,create event with alarm for meeting in two hours,alarm_set,create event alarm meeting two hours
268,set my alarm for six am tomorrow,alarm_set,set alarm six tomorrow
269,please set an alarm for seven hundred and thirty am tomorrow,alarm_set,please set alarm seven hundred thirty tomorrow
270,wake me up in thirty minutes,alarm_set,wake thirty minutes
271,schedule an alarm to wake me up after three hours,alarm_set,schedule alarm wake three hours
272,set an alarm,alarm_set,set alarm
273,make an alarm for me at five am tomorrow,alarm_set,make alarm five tomorrow
274,set alarm for twelve weeks from today at eight am,alarm_set,set alarm twelve weeks today eight
275,wake me up at time,alarm_set,wake time
276,set wake up Thursday seven am,alarm_set,set wake Thursday seven
277,please set my alarm for five pm,alarm_set,please set alarm five pm
278,get me up in half an hour,alarm_set,get half hour
279,wake me up at this time,alarm_set,wake time
280,wake me up at ten,alarm_set,wake ten
281,set an alarm for five hundred and thirty,alarm_set,set alarm five hundred thirty
282,put alarm at five am,alarm_set,put alarm five
283,wake me up on Friday at five in the morning i need to catch the train,alarm_set,wake Friday five morning need catch train
284,set an alarm for seven thirty am,alarm_set,set alarm seven thirty
285,please ring the wake up alarm at eight am next saturday,alarm_set,please ring wake alarm eight next saturday
286,create an alarm for six am,alarm_set,create alarm six
287,i need an alarm set for five hundred and thirty am tomorrow,alarm_set,need alarm set five hundred thirty tomorrow
288,set a repeating reminder alarm for the facebook event i have to attend on seventh april,alarm_set,set repeating reminder alarm facebook event attend seventh april
289,set alarm on twenty fifth may at five pm,alarm_set,set alarm twenty fifth may five pm
290,please wake me up at seven thirty am,alarm_set,please wake seven thirty
291,set an alarm for eight am,alarm_set,set alarm eight
292,alarm five pm tuesday,alarm_set,alarm five pm tuesday
293,wake me up at five thirty,alarm_set,wake five thirty
294,set my alarm for eight am,alarm_set,set alarm eight
295,set my alarm for six thirty in the morning tomorrow,alarm_set,set alarm six thirty morning tomorrow
296,set the time,alarm_set,set time
297,i need an alarm,alarm_set,need alarm
298,wake me up,alarm_set,wake
299,i need a six am wakeup call,alarm_set,need six wakeup call
300,wake me up at five am this week,alarm_set,wake five week
301,set alarm for saturday morning soccer practice at eight am,alarm_set,set alarm saturday morning soccer practice eight
302,please set the alarm for next morning to seven am,alarm_set,please set alarm next morning seven
303,can you set my alarm for seven thirty am,alarm_set,set alarm seven thirty
304,set alarm at two am,alarm_set,set alarm two
305,please set the alarm for eight pm wednesday evening,alarm_set,please set alarm eight pm wednesday evening
306,could you please set an alarm at six am,alarm_set,could please set alarm six
307,set an alarm for four in the afternoon,alarm_set,set alarm four afternoon
308,set a reminder i need to wake up at five am every morning,alarm_set,set reminder need wake five every morning
309,please set an alarm at seven am tomorrow morning,alarm_set,please set alarm seven tomorrow morning
310,create an alarm for today at ten am,alarm_set,create alarm today ten
311,i need you to set an alarm,alarm_set,need set alarm
312,make an alarm to help me remember,alarm_set,make alarm help remember
313,set an alarm for two hours from now,alarm_set,set alarm two hours
314,set alarm for nine am,alarm_set,set alarm nine
315,set an alarm at six in the morning,alarm_set,set alarm six morning
316,make an alarm for the morning,alarm_set,make alarm morning
317,set an alarm for two hours from now please,alarm_set,set alarm two hours please
318,set an alarm at six am,alarm_set,set alarm six
319,place alarm at five o'clock morning,alarm_set,place alarm five o'clock morning
320,wake me up at five hundred and thirty,alarm_set,wake five hundred thirty
321,i want to wake up at six am tomorrow please,alarm_set,want wake six tomorrow please
322,call me at six am,alarm_set,call six
323,set an alarm for one hour from now,alarm_set,set alarm one hour
324,new alarm for six am,alarm_set,new alarm six
325,i need a reminder alarm at one,alarm_set,need reminder alarm one
326,please set alarm at five pm,alarm_set,please set alarm five pm
327,set an eight hundred am alarm for next tuesday,alarm_set,set eight hundred alarm next tuesday
328,set alarm for reminder,alarm_set,set alarm reminder
329,make an alarm for three pm,alarm_set,make alarm three pm
330,the set alarm for nine pm on Thursday night,alarm_set,set alarm nine pm Thursday night
331,set an alarm for five am,alarm_set,set alarm five
332,confirm that the alarm is set for tomorrow,alarm_set,confirm alarm set tomorrow
333,please make me wake up at four am tomorrow,alarm_set,please make wake four tomorrow
334,remind me at five pm,alarm_set,remind five pm
335,turn on alarm thirty minutes before liverpool started to play,alarm_set,turn alarm thirty minutes liverpool started play
336,set a wake up call for ten am,alarm_set,set wake call ten
337,set an alarm for thursday at seven pm,alarm_set,set alarm thursday seven pm
338,please set alarm to my mobile phones,alarm_set,please set alarm mobile phones
339,alarm me at eight am,alarm_set,alarm eight
340,wake me at seven am,alarm_set,wake seven
341,set an alarm at ten tomorrow to remind me a meeting,alarm_set,set alarm ten tomorrow remind meeting
342,set an alarm at six am tomorrow,alarm_set,set alarm six tomorrow
343,i need an alarm for sunday at eight am can you please set one for me,alarm_set,need alarm sunday eight please set one
344,turn on my alarm,alarm_set,turn alarm
345,remind me at six thirty pm,alarm_set,remind six thirty pm
346,add alarm,alarm_set,add alarm
347,can you set the alarm for one hundred and thirty,alarm_set,set alarm one hundred thirty
348,alarm time for twelve pm,alarm_set,alarm time twelve pm
349,wake me at daybreak,alarm_set,wake daybreak
350,don't talk,audio_volume_mute,talk
351,go silent until three pm,audio_volume_mute,go silent three pm
352,please do not talk for thirty minutes,audio_volume_mute,please talk thirty minutes
353,Silence speakers,audio_volume_mute,Silence speakers
354,please be quiet,audio_volume_mute,please quiet
355,silently adjust,audio_volume_mute,silently adjust
356,turn off audio,audio_volume_mute,turn audio
357,turn off sound,audio_volume_mute,turn sound
358,set to mute,audio_volume_mute,set mute
359,keep quiet,audio_volume_mute,keep quiet
360,please stop for a bit,audio_volume_mute,please stop bit
361,Please pause the song,audio_volume_mute,Please pause song
362,off the speakers,audio_volume_mute,speakers
363,be silent for thirty minutes,audio_volume_mute,silent thirty minutes
364,can you place the sound on mute,audio_volume_mute,place sound mute
365,stop making sounds for forty minutes,audio_volume_mute,stop making sounds forty minutes
366,can you please stop speaking,audio_volume_mute,please stop speaking
367,mute volume,audio_volume_mute,mute volume
368,please do not answer,audio_volume_mute,please answer
369,please be silent until i tell you not to be,audio_volume_mute,please silent tell
370,i want to mute the speaker,audio_volume_mute,want mute speaker
371,silent mode,audio_volume_mute,silent mode
372,mute yourself when i am in a meeting,audio_volume_mute,mute meeting
373,please pause yourself,audio_volume_mute,please pause
374,please keep quiet for the next hour,audio_volume_mute,please keep quiet next hour
375,mute the living room speakers,audio_volume_mute,mute living room speakers
